{
  "schema_version": "1.0.0",
  "artifact_type": "formal_result_payload_manifest",
  "run_id": "m3a_fixture_run_20260713",
  "formal_result_id": "formal-m3a-fixture-001",
  "execution_id": "sandboxie-exec-28037fb7a0cf4d2bbf4c28dc98adb249",
  "run_output_manifest_sha256": "5e89c00f2c1fd5bb69c4433d72717543c545e5aa5fc508485ec7810364a4554e",
  "formal_core_semantic_sha256": {
    "decision_variables.json": "9b04b3c92ba16e5f85ee15b5b34847d00bf6ecccdc74789f85f123d4bcb2827c",
    "optimization_validation.json": "b244e4e80bdb47508a5d7dcd70d44c3cc69d37112d1d364a57f69cbfabae5c0a",
    "optimality_certificate.json": "cc65fd3c5bc407336fc8ca81fd7c4e214593ea9b29eefa8eaa7cdc4429d4bc48",
    "negative_tests.json": "ee17bab2efcfff33cc8971f8cf9e8a02255e5db4eb5929170a332add0b228fe0"
  },
  "formal_result_core_digest": "aebc339e4651b5aab568f0e4729e87b09691a103341a243346ffc4293e9252c0",
  "result_derivation_contract": {
    "contract_version": "1.0.0",
    "raw_output_path": "result.json",
    "mappings": [
      {
        "source_pointer": "/objective",
        "target_artifact": "decision_variables.json",
        "target_pointer": "/payload/x"
      },
      {
        "source_pointer": "/objective",
        "target_artifact": "optimization_validation.json",
        "target_pointer": "/payload/metrics/objective"
      },
      {
        "source_pointer": "/solver_status",
        "target_artifact": "optimality_certificate.json",
        "target_pointer": "/status"
      },
      {
        "source_pointer": "/solver_status",
        "target_artifact": "optimality_certificate.json",
        "target_pointer": "/payload/solver_status"
      },
      {
        "source_pointer": "/negative_tests_status",
        "target_artifact": "negative_tests.json",
        "target_pointer": "/status"
      },
      {
        "source_pointer": "/negative_tests/0/test_id",
        "target_artifact": "negative_tests.json",
        "target_pointer": "/payload/results/0/test_id"
      },
      {
        "source_pointer": "/negative_tests/0/status",
        "target_artifact": "negative_tests.json",
        "target_pointer": "/payload/results/0/status"
      },
      {
        "source_pointer": "/negative_tests/1/test_id",
        "target_artifact": "negative_tests.json",
        "target_pointer": "/payload/results/1/test_id"
      },
      {
        "source_pointer": "/negative_tests/1/status",
        "target_artifact": "negative_tests.json",
        "target_pointer": "/payload/results/1/status"
      }
    ]
  },
  "collector_derivation_attestation_sha256": "9bfd86d18b1533244b4de91e04025f4403d93ac6695b96c8e065ee7f72f249fa"
}
